{
  "schema_version": "1.2",
  "photo_id": "IMG_0001",
  "timestamp": "2024-10-01T14:30:00",
  "device_id": "iphone",
  "people": [],
  "scene": "",
  "location": "",
  "location_coords": "31.230000,121.470000",
  "objects": [],
  "actions": [],
  "emotion": [],
  "tags": [],
  "weather": {
    "date": "2024-10-01",
    "code": 61,
    "condition": "小雨",
    "temp_max_c": 25.2,
    "temp_min_c": 20.2,
    "temp_mean_c": 22.7,
    "precipitation_mm": 4.9,
    "source": "open-meteo",
    "timezone": "Asia/Shanghai"
  },
  "quality": {
    "blur": false,
    "face_detected": false
  },
  "source": {
    "path": "/Users/you/MemoryGraph/data/photos/IMG_0001.jpg",
    "width": 4032,
    "height": 3024
  }
}
